{
  "$schema": "https://json-schema.org/draft/2020-12/schema",
  "$id": "https://naseej.example/schemas/threat_pattern.schema.json",
  "title": "Naseej Threat Pattern",
  "description": "Zero-PII threat intelligence object exchanged between bank nodes on the Naseej network. By contract, this object MUST NOT contain names, national IDs, IBANs, BBANs, phone numbers, email addresses, exact account numbers, device identifiers, or raw transaction records. All quantitative values are bucketed or aggregated before inclusion.",
  "type": "object",
  "additionalProperties": false,
  "required": [
    "pattern_id",
    "pattern_hash",
    "typology",
    "graph_signature",
    "velocity_features",
    "risk_score",
    "confidence",
    "detection_timestamp",
    "source_node_id",
    "evidence_summary",
    "privacy_guarantees",
    "governance_tags"
  ],
  "properties": {
    "pattern_id": {
      "type": "string",
      "description": "Globally unique identifier for this broadcast (UUIDv4). Identifies the message, not any customer.",
      "format": "uuid"
    },
    "pattern_hash": {
      "type": "string",
      "description": "Deterministic SHA-256-derived hash of the normalized, bucketed pattern features. Format: NSJ_<PATTERN_TYPE>_<16-hex>. Same fraud topology at different banks yields the same hash; the hash is not reversible to identities.",
      "pattern": "^NSJ_[A-Z0-9_]+_[0-9a-f]{16}$"
    },
    "typology": {
      "type": "string",
      "description": "AML typology detected by the pattern library.",
      "enum": [
        "fan_in",
        "fan_out",
        "simple_cycle",
        "mule_velocity",
        "rapid_sweep",
        "cross_bank_pass_through",
        "scatter_gather",
        "gather_scatter"
      ]
    },
    "graph_signature": {
      "type": "object",
      "description": "Structural shape of the transaction subgraph. Degree sequences and counts only — node identities are positional, never account-derived.",
      "additionalProperties": false,
      "required": ["node_count", "edge_count", "in_degree_sequence", "out_degree_sequence"],
      "properties": {
        "node_count": { "type": "integer", "minimum": 2 },
        "edge_count": { "type": "integer", "minimum": 1 },
        "in_degree_sequence": {
          "type": "array",
          "description": "Sorted in-degree sequence of the anonymized subgraph.",
          "items": { "type": "integer", "minimum": 0 }
        },
        "out_degree_sequence": {
          "type": "array",
          "description": "Sorted out-degree sequence of the anonymized subgraph.",
          "items": { "type": "integer", "minimum": 0 }
        },
        "diameter": { "type": "integer", "minimum": 1 },
        "is_cross_bank": {
          "type": "boolean",
          "description": "True when the pattern spans more than one institution. No bank routing detail beyond this flag."
        }
      }
    },
    "velocity_features": {
      "type": "object",
      "description": "Bucketed temporal behavior. Buckets, never raw values, so amounts and timings cannot be replayed.",
      "additionalProperties": false,
      "required": ["window_bucket", "tx_count_bucket", "amount_bucket"],
      "properties": {
        "window_bucket": {
          "type": "string",
          "description": "Time window over which the pattern completed.",
          "enum": ["under_1h", "1h_to_6h", "6h_to_24h", "1d_to_7d", "over_7d"]
        },
        "tx_count_bucket": {
          "type": "string",
          "description": "Number of transactions in the pattern.",
          "enum": ["2_to_5", "6_to_10", "11_to_25", "26_to_100", "over_100"]
        },
        "amount_bucket": {
          "type": "string",
          "description": "Total flow magnitude, log-bucketed in SAR equivalents.",
          "enum": ["under_5k", "5k_to_25k", "25k_to_100k", "100k_to_1m", "over_1m"]
        },
        "burst_score_bucket": {
          "type": "string",
          "description": "How concentrated in time the inflows were.",
          "enum": ["low", "medium", "high"]
        }
      }
    },
    "risk_score": {
      "type": "number",
      "description": "Detecting node's calibrated risk estimate for this pattern, 0–1.",
      "minimum": 0,
      "maximum": 1
    },
    "confidence": {
      "type": "number",
      "description": "Detecting node's confidence in the typology classification, 0–1. Distinct from risk: a pattern can be clearly a fan-in (high confidence) with moderate risk.",
      "minimum": 0,
      "maximum": 1
    },
    "detection_timestamp": {
      "type": "string",
      "description": "UTC time the detecting node generated this object (ISO-8601). Rounded to the minute to avoid correlating with a specific transaction.",
      "format": "date-time"
    },
    "source_node_id": {
      "type": "string",
      "description": "Opaque Naseej network node identifier of the detecting institution (assigned at onboarding). Not a SAMA bank code or routing identifier.",
      "pattern": "^NODE_[A-Z0-9]{8}$"
    },
    "evidence_summary": {
      "type": "string",
      "description": "Human-readable, PII-free description of why the pattern was flagged, for the receiving bank's analysts. Free text is screened by the privacy layer's PII detector before broadcast.",
      "maxLength": 500
    },
    "privacy_guarantees": {
      "type": "object",
      "description": "Machine-checkable attestation of the privacy controls applied before broadcast.",
      "additionalProperties": false,
      "required": ["zero_pii_verified", "bucketing_version", "hash_algorithm"],
      "properties": {
        "zero_pii_verified": {
          "type": "boolean",
          "description": "True when the object passed the automated verify_zero_pii() check at the source node.",
          "const": true
        },
        "bucketing_version": {
          "type": "string",
          "description": "Version of the bucket-boundary configuration used. Hashes are only comparable across nodes using the same version."
        },
        "hash_algorithm": {
          "type": "string",
          "enum": ["sha256-canonical-json-v1"]
        },
        "k_anonymity_floor": {
          "type": "integer",
          "description": "Minimum number of accounts that would produce an identical object — patterns below this floor are not broadcast.",
          "minimum": 1
        }
      }
    },
    "governance_tags": {
      "type": "object",
      "description": "Routing, retention, and review metadata for the receiving node's compliance team.",
      "additionalProperties": false,
      "required": ["sharing_scope", "retention_days", "requires_human_review"],
      "properties": {
        "sharing_scope": {
          "type": "string",
          "description": "Who may consume this object. local_only: source node only. bilateral: source node plus shared_with_node_ids. network_all: all member bank nodes. regulator_only: source node plus regulator/admin nodes.",
          "enum": ["local_only", "bilateral", "network_all", "regulator_only"]
        },
        "shared_with_node_ids": {
          "type": "array",
          "description": "Bilateral recipients: opaque node ids allowed to read this object when sharing_scope is 'bilateral'. Ignored for other scopes. An empty or absent list under 'bilateral' means no recipients (fail closed).",
          "items": { "type": "string", "pattern": "^NODE_[A-Z0-9]{8}$" },
          "uniqueItems": true,
          "maxItems": 32
        },
        "retention_days": {
          "type": "integer",
          "description": "Days after which receiving nodes must purge this object.",
          "minimum": 1,
          "maximum": 3650
        },
        "requires_human_review": {
          "type": "boolean",
          "description": "True when receiving nodes must route matches to an analyst rather than auto-actioning."
        },
        "regulatory_basis": {
          "type": "string",
          "description": "Reference to the legal basis for sharing (e.g. 'SAMA-CFF-3.2'). Free text, no case identifiers."
        }
      }
    }
  }
}
