{
  "pattern_id": "7f3c9a1e-2b4d-4e8f-9a6c-1d5e8b3f7a20",
  "pattern_hash": "NSJ_MULE_VELOCITY_8f9b2c4d1e7a3c5d",
  "typology": "mule_velocity",
  "graph_signature": {
    "node_count": 7,
    "edge_count": 6,
    "in_degree_sequence": [0, 0, 0, 0, 0, 1, 5],
    "out_degree_sequence": [0, 0, 1, 1, 1, 1, 2],
    "diameter": 2,
    "is_cross_bank": true
  },
  "velocity_features": {
    "window_bucket": "under_1h",
    "tx_count_bucket": "2_to_5",
    "amount_bucket": "5k_to_25k",
    "burst_score_bucket": "high"
  },
  "risk_score": 0.91,
  "confidence": 0.87,
  "detection_timestamp": "2026-06-11T09:42:00Z",
  "source_node_id": "NODE_A7C2F9E1",
  "evidence_summary": "Fan-in of 5 sub-threshold transfers into a single account within 40 minutes, followed by an international wire sweep of the accumulated balance.",
  "privacy_guarantees": {
    "zero_pii_verified": true,
    "bucketing_version": "buckets-v1",
    "hash_algorithm": "sha256-canonical-json-v1",
    "k_anonymity_floor": 5
  },
  "governance_tags": {
    "sharing_scope": "network_all",
    "retention_days": 90,
    "requires_human_review": true,
    "regulatory_basis": "SAMA-CFF-early-warning"
  }
}
